{
	"schema": 1,
	"title_key": "cyberblock.daemon.traffic_switch",
	"text_key": "cyberblock.daemon.traffic_switch.text",
	"sequence": [
		"55",
		"BD",
		"7A"
	],
	"kinds": [
		"traffic",
		"terminal"
	],
	"action": "traffic_switch",
	"tiers": [
		{
			"seconds": 0,
			"radius": 20
		},
		{
			"seconds": 0,
			"radius": 35
		},
		{
			"seconds": 0,
			"radius": 60
		}
	],
	"weight": 4,
	"min_security": 1
}
